{
  "$schema": "https://json-schema.org/draft/2020-12/schema",
  "$id": "https://vllm-apple.local/schemas/runtime/generative-evaluation-report-v1.schema.json",
  "title": "Privacy-preserving generative evaluation report v1",
  "type": "object",
  "additionalProperties": false,
  "required": ["schema_version", "candidate_id", "model", "modality", "plan_sha256", "provenance", "sample_count", "median_wall_time_ms", "median_first_output_ms", "maximum_peak_rss_bytes", "minimum_frames_per_second", "samples", "issues", "stores_prompt", "stores_output", "passed"],
  "properties": {
    "schema_version": {"const": 1},
    "candidate_id": {"type": "string", "minLength": 1, "maxLength": 128},
    "model": {"type": "string", "minLength": 1, "maxLength": 4096},
    "modality": {"enum": ["image", "video"]},
    "plan_sha256": {"type": "string", "minLength": 64, "maxLength": 64},
    "provenance": {
      "type": "object",
      "additionalProperties": false,
      "required": ["platform", "architecture", "soc", "gpu_core_count", "total_memory_bytes", "backend", "backend_version", "artifact_format", "artifact_bytes", "quantization", "license", "base_model"],
      "properties": {
        "platform": {"type": "string", "minLength": 1, "maxLength": 512},
        "architecture": {"type": "string", "minLength": 1, "maxLength": 512},
        "soc": {"type": "string", "minLength": 1, "maxLength": 512},
        "gpu_core_count": {"type": ["integer", "null"], "minimum": 1, "maximum": 1024},
        "total_memory_bytes": {"type": "integer", "minimum": 1, "maximum": 17592186044416},
        "backend": {"type": "string", "minLength": 1, "maxLength": 512},
        "backend_version": {"type": "string", "minLength": 1, "maxLength": 512},
        "artifact_format": {"type": "string", "minLength": 1, "maxLength": 512},
        "artifact_bytes": {"type": "integer", "minimum": 1, "maximum": 17592186044416},
        "quantization": {"type": "string", "minLength": 1, "maxLength": 512},
        "license": {"type": ["string", "null"], "minLength": 1, "maxLength": 4096},
        "base_model": {"type": ["string", "null"], "minLength": 1, "maxLength": 4096},
        "artifact_root_sha256": {"type": ["string", "null"], "minLength": 64, "maxLength": 64}
      }
    },
    "sample_count": {"type": "integer", "minimum": 1, "maximum": 32},
    "median_wall_time_ms": {"type": "number", "minimum": 0, "maximum": 86400000},
    "median_first_output_ms": {"type": "number", "minimum": 0, "maximum": 86400000},
    "maximum_peak_rss_bytes": {"type": "integer", "minimum": 1, "maximum": 17592186044416},
    "minimum_frames_per_second": {"type": "number", "minimum": 0},
    "samples": {
      "type": "array",
      "minItems": 1,
      "maxItems": 32,
      "items": {
        "type": "object",
        "additionalProperties": false,
        "required": ["sample_index", "wall_time_ms", "first_output_ms", "peak_rss_bytes", "memory_pressure", "thermal_state", "output_width", "output_height", "output_frames", "output_sha256", "stores_prompt", "stores_output"],
        "properties": {
          "sample_index": {"type": "integer", "minimum": 0, "maximum": 31},
          "wall_time_ms": {"type": "number", "minimum": 0, "maximum": 86400000},
          "first_output_ms": {"type": "number", "minimum": 0, "maximum": 86400000},
          "peak_rss_bytes": {"type": "integer", "minimum": 1, "maximum": 17592186044416},
          "memory_pressure": {"enum": ["normal", "warning", "critical", "unknown"]},
          "thermal_state": {"enum": ["nominal", "fair", "serious", "critical", "unknown"]},
          "output_width": {"type": "integer", "minimum": 1, "maximum": 4096},
          "output_height": {"type": "integer", "minimum": 1, "maximum": 4096},
          "output_frames": {"type": "integer", "minimum": 1, "maximum": 257},
          "output_sha256": {"type": "string", "minLength": 64, "maxLength": 64},
          "stores_prompt": {"type": "boolean"},
          "stores_output": {"type": "boolean"}
        }
      }
    },
    "issues": {"type": "array", "maxItems": 256, "items": {"type": "string", "minLength": 1, "maxLength": 128}},
    "stores_prompt": {"type": "boolean"},
    "stores_output": {"type": "boolean"},
    "passed": {"type": "boolean"}
  }
}
