{
  "candidate_id": "qwen-image-2.1",
  "issues": [],
  "maximum_peak_rss_bytes": 17954488320,
  "median_first_output_ms": 48231.3246249978,
  "median_wall_time_ms": 48262.4019165014,
  "minimum_frames_per_second": 0.019235329314037538,
  "modality": "image",
  "model": "Qwen/Qwen-Image-2.1",
  "passed": true,
  "plan_sha256": "afbb1579827bd2a3b4fa44d615e51e624a89f37ca9c8c58a6051c6bb5299ddc4",
  "provenance": {
    "architecture": "arm64",
    "artifact_bytes": 18516268404,
    "artifact_format": "diffusers",
    "artifact_root_sha256": "dcacfc334ed0821c18a1ff079e37cae9d99de0966c821c508a145134e85f38cf",
    "backend": "diffusers",
    "backend_version": "0.41.0.dev0",
    "base_model": null,
    "gpu_core_count": 10,
    "license": "other",
    "platform": "Darwin",
    "quantization": "int8",
    "soc": "Apple M4",
    "total_memory_bytes": 34359738368
  },
  "sample_count": 2,
  "samples": [
    {
      "first_output_ms": 44506.721124998876,
      "memory_pressure": "warning",
      "output_frames": 1,
      "output_height": 512,
      "output_sha256": "b262bd68d44f93637b9949caf7ff7ce0b6b6ed839c3a2468681952b215ec4d95",
      "output_width": 512,
      "peak_rss_bytes": 17954488320,
      "sample_index": 0,
      "stores_output": false,
      "stores_prompt": false,
      "thermal_state": "nominal",
      "wall_time_ms": 44537.13137500017
    },
    {
      "first_output_ms": 51955.92812499672,
      "memory_pressure": "warning",
      "output_frames": 1,
      "output_height": 512,
      "output_sha256": "b262bd68d44f93637b9949caf7ff7ce0b6b6ed839c3a2468681952b215ec4d95",
      "output_width": 512,
      "peak_rss_bytes": 17954488320,
      "sample_index": 1,
      "stores_output": false,
      "stores_prompt": false,
      "thermal_state": "nominal",
      "wall_time_ms": 51987.672458002635
    }
  ],
  "schema_version": 1,
  "stores_output": false,
  "stores_prompt": false
}
